{"alvo":"ALVO-0021","artefatos_sha256":{"bruto.json":"ba12b5766985bdbfa2402ff2c1a5327324956d3177967e86fcde0bec847edf56","manifesto.em_execucao.json":"a8a63c54e7fbc75e912ef98330711a18b76e12c4e8ce5838cf3cd566a45febe6","manifesto.pendente.json":"be046196d879c2a7a875f217bcf1b2dee5977fbdfa132e3d268bff615750a6c0","normalizado.json":"bdca7cf544460ede04862e991ec7960d2b003643509dea8912be91269336d314","processo.json":"bbb01fb990455984e299c2f25a38d83907abfd597bb174cb1da62bd3410d0a2e","stderr.bin":"e42d853db7bb1d25aa1d2953716229cba13a17c7687b636e710ac91e11c4222f","stdout.bin":"e3b0c44298fc1c149afbf4c8996fb92427ae41e4649b934ca495991b7852b855","versoes.json":"8806f416b2b2d13361d0c8e28f13f54569e336c39069a6f4751bb2482839fc2b"},"bloco":null,"codigo_saida":0,"comando":["/usr/local/bin/semgrep","scan","--config","/opt/regras-semgrep/python","--json","--metrics=off","--jobs","1","--output","/saida/bruto.json.part","/entrada"],"condicao":"C2","duracao_monotonica_segundos":28.367393817,"entrada_commit":"f7797964e1cd63a1cbcc8ced721fa41db674c8e0","entrada_sha256":"21122409b2c8ab10c99af946fbd53991ead7ee5daace66e836da17c985bbdc57","estado":"concluida","execucao_id":"C2-ALVO-0021-R01","falha_mensagem":null,"falha_tipo":null,"ferramenta":"semgrep","finalidade":"coleta","imagem":"tcc-sast:py3.12.13-bandit1.9.4-semgrep1.172.0","imagem_digest":"sha256:4680184d423a5304784739e696933e74a556ed3ec3d9ea63dcc4a3e69ea691ad","inicio_utc":"2026-08-11T15:16:57.406805Z","repeticao":1,"schema_version":"1.0","tentativa":1,"termino_utc":"2026-08-11T15:17:25.773577Z"}