{"alvo":"ALVO-0024","artefatos_sha256":{},"bloco":null,"codigo_saida":null,"comando":["/usr/local/bin/semgrep","scan","--config","/opt/regras-semgrep/python","--json","--metrics=off","--jobs","1","--output","/saida/bruto.json.part","/entrada"],"condicao":"C2","duracao_monotonica_segundos":null,"entrada_commit":"7aca8b78ba948c841d6cb1cc2a244922a27e842b","entrada_sha256":"876dc0769e8ab39482f4f085b17b51b213e1d090330bbf119794da06b32bd7e5","estado":"pendente","execucao_id":"C2-ALVO-0024-R01","falha_mensagem":null,"falha_tipo":null,"ferramenta":"semgrep","finalidade":"coleta","imagem":"tcc-sast:py3.12.13-bandit1.9.4-semgrep1.172.0","imagem_digest":"sha256:4680184d423a5304784739e696933e74a556ed3ec3d9ea63dcc4a3e69ea691ad","inicio_utc":null,"repeticao":1,"schema_version":"1.0","tentativa":1,"termino_utc":null}