{"alvo":"ALVO-0001","artefatos_sha256":{},"bloco":null,"codigo_saida":null,"comando":["/usr/local/bin/bandit","--recursive","/entrada","--format","json","--output","/saida/bruto.json.part"],"condicao":"C1","duracao_monotonica_segundos":null,"entrada_commit":"55f63201c85190e760a8fa34a580a9bf918dbf36","entrada_sha256":"fd824e2a073f0b02ba628ebb112b9a06f9347698927697e6b6591ef6704e8ea5","estado":"pendente","execucao_id":"C1-ALVO-0001-R01","falha_mensagem":null,"falha_tipo":null,"ferramenta":"bandit","finalidade":"coleta","imagem":"tcc-sast:py3.12.13-bandit1.9.4-semgrep1.172.0","imagem_digest":"sha256:4680184d423a5304784739e696933e74a556ed3ec3d9ea63dcc4a3e69ea691ad","inicio_utc":null,"repeticao":1,"schema_version":"1.0","tentativa":1,"termino_utc":null}