{"alvo":"ALVO-0007","artefatos_sha256":{"bruto.json":"8fa8cb8f2f93a06014ce6109a1995d34c6aaebec3eb6debf1e5e7dbd5d6b6187","manifesto.em_execucao.json":"8c0f4ab6bf423f9e58ac7ae50323211df1ab1728cda8e715d8ca6b3fb0295025","manifesto.pendente.json":"1b846ed9bea5ead6d8ee92a099a0d5c03feb1c1a79954edbe56421e5130f592a","normalizado.json":"d267b97ee58b757427c023c87d6d86ee83323729b584955120f01eb10805d435","processo.json":"b1c1de27930025ec3da69d8b3c793d0602cb5212dc4bef57c03218c892fba8d4","stderr.bin":"8725bcb7725395078fffce3426191660c2ecee7d0709d7a9e867052f085f3435","stdout.bin":"e3b0c44298fc1c149afbf4c8996fb92427ae41e4649b934ca495991b7852b855","versoes.json":"ea188be6bb7686fa69e9b244c76e2af965e9e97808b4666b6901554ae2bc473c"},"bloco":null,"codigo_saida":1,"comando":["/usr/local/bin/bandit","--recursive","/entrada","--format","json","--output","/saida/bruto.json.part"],"condicao":"C1","duracao_monotonica_segundos":1.233364925,"entrada_commit":"a1d8f89fac2e57093189853c6527c2b01fc1d9c1","entrada_sha256":"48768e4c5d80ec67c770ea9fd1bd5cb359619ebffaff6ae73c07f0d82b395719","estado":"concluida","execucao_id":"C1-ALVO-0007-R01","falha_mensagem":null,"falha_tipo":null,"ferramenta":"bandit","finalidade":"coleta","imagem":"tcc-sast:py3.12.13-bandit1.9.4-semgrep1.172.0","imagem_digest":"sha256:4680184d423a5304784739e696933e74a556ed3ec3d9ea63dcc4a3e69ea691ad","inicio_utc":"2026-08-11T14:48:09.931072Z","repeticao":1,"schema_version":"1.0","tentativa":1,"termino_utc":"2026-08-11T14:48:11.164444Z"}