{"alvo":"ALVO-0013","artefatos_sha256":{"bruto.json":"1dbc7f5f9bac06e0d52436aa6ce851dc84be3dcee671a978dcd305c0c3a98c9b","manifesto.em_execucao.json":"2b70f3fb47b40f454a2ce86bd7abd62451d2f0abb024c1e515af4856cd654d5a","manifesto.pendente.json":"7e6cdc065fe5797253891cb1f42951a3aa6ed531c522811d357ec5b2479a308d","normalizado.json":"46d7b1c62ba9a3b18ee7faf463abdde5a65ab045f7903d7c6b8c633b593eb7a2","processo.json":"57f92208e06ae2dacbaef8ac0edf189137fc636ec479bbb0937dc5ad49833d5d","stderr.bin":"8725bcb7725395078fffce3426191660c2ecee7d0709d7a9e867052f085f3435","stdout.bin":"e3b0c44298fc1c149afbf4c8996fb92427ae41e4649b934ca495991b7852b855","versoes.json":"ea188be6bb7686fa69e9b244c76e2af965e9e97808b4666b6901554ae2bc473c"},"bloco":null,"codigo_saida":1,"comando":["/usr/local/bin/bandit","--recursive","/entrada","--format","json","--output","/saida/bruto.json.part"],"condicao":"C1","duracao_monotonica_segundos":1.126604869,"entrada_commit":"5e682aca1b58e03362a5fbd9fc88c37626e429ce","entrada_sha256":"71e8435f06e788978bc92c55c57f96f2ac2b5de09238f0fe517c49d3f74ee9b0","estado":"concluida","execucao_id":"C1-ALVO-0013-R01","falha_mensagem":null,"falha_tipo":null,"ferramenta":"bandit","finalidade":"coleta","imagem":"tcc-sast:py3.12.13-bandit1.9.4-semgrep1.172.0","imagem_digest":"sha256:4680184d423a5304784739e696933e74a556ed3ec3d9ea63dcc4a3e69ea691ad","inicio_utc":"2026-08-11T15:24:54.589974Z","repeticao":1,"schema_version":"1.0","tentativa":1,"termino_utc":"2026-08-11T15:24:55.716584Z"}