{"alvo":"ALVO-0006","artefatos_sha256":{"bruto.json":"dc899d521c58b4800ad49b6d7d125276152fa09781dc74e5a5315554db71dd27","manifesto.em_execucao.json":"2b4053d9e20e307c81289fd229992b896df2bf3b6a659de89dbbd36654891ff7","manifesto.pendente.json":"2ac3912e3dae6f05af362f2adb30843a68efab6d246b17967d12d2284ef41ec0","normalizado.json":"b49f6f5c3b6667d9a9f272db899e4df3c44573d60722ad58317799f841796616","processo.json":"a241ae0abfa933c8dd01f9236550da383163e303e530990bf3f746087347f4cb","stderr.bin":"8725bcb7725395078fffce3426191660c2ecee7d0709d7a9e867052f085f3435","stdout.bin":"e3b0c44298fc1c149afbf4c8996fb92427ae41e4649b934ca495991b7852b855","versoes.json":"ea188be6bb7686fa69e9b244c76e2af965e9e97808b4666b6901554ae2bc473c"},"bloco":null,"codigo_saida":1,"comando":["/usr/local/bin/bandit","--recursive","/entrada","--format","json","--output","/saida/bruto.json.part"],"condicao":"C1","duracao_monotonica_segundos":1.259466466,"entrada_commit":"25bdef1e32055bfb6366856acc5db829e61e3647","entrada_sha256":"c3a3ca1c23c9970d5a51ac60e544c1798adb6963cf64ac0e16a747e309b24b7c","estado":"concluida","execucao_id":"C1-ALVO-0006-R01","falha_mensagem":null,"falha_tipo":null,"ferramenta":"bandit","finalidade":"coleta","imagem":"tcc-sast:py3.12.13-bandit1.9.4-semgrep1.172.0","imagem_digest":"sha256:fde946f0659e291969b8999849b3573f4c32dda17f5003b358e62628c11d12c4","inicio_utc":"2026-08-11T15:48:35.887194Z","repeticao":1,"schema_version":"1.0","tentativa":3,"termino_utc":"2026-08-11T15:48:37.146559Z"}