{"alvo":"ALVO-0008","artefatos_sha256":{},"bloco":null,"codigo_saida":null,"comando":["/usr/local/bin/semgrep","scan","--config","/opt/regras-semgrep/python","--json","--metrics=off","--jobs","1","--output","/saida/bruto.json.part","/entrada"],"condicao":"C2","duracao_monotonica_segundos":null,"entrada_commit":"d5d8875559e21222bbbaadb7b9f0af592c6eb7fa","entrada_sha256":"c8889b657d313114870620cc663f7e0aab4d4e3020f446c1e5411139a5f38c10","estado":"em_execucao","execucao_id":"C2-ALVO-0008-R01","falha_mensagem":null,"falha_tipo":null,"ferramenta":"semgrep","finalidade":"coleta","imagem":"tcc-sast:py3.12.13-bandit1.9.4-semgrep1.172.0","imagem_digest":"sha256:4680184d423a5304784739e696933e74a556ed3ec3d9ea63dcc4a3e69ea691ad","inicio_utc":"2026-08-11T15:10:34.181255Z","repeticao":1,"schema_version":"1.0","tentativa":1,"termino_utc":null}