{"alvo":"ALVO-0022","artefatos_sha256":{"bruto.json":"71d6fe11cfccfe65c7431490481ac002f8203419283f0f773781b6bb501beee0","manifesto.em_execucao.json":"c8cd748a8e15f3296b7dbabe69ba65f737313fa776372085a67851183af9c736","manifesto.pendente.json":"b37c1ed4fe6df139e7425d0eb5a72ccc10a9c60209b780ff0c15c7262dba8cad","processo.json":"33585c891af162ea23e72168b97f88437a1da503cf8ea5a21a2b7e8d0833b294","stderr.bin":"8725bcb7725395078fffce3426191660c2ecee7d0709d7a9e867052f085f3435","stdout.bin":"e3b0c44298fc1c149afbf4c8996fb92427ae41e4649b934ca495991b7852b855","versoes.json":"ea188be6bb7686fa69e9b244c76e2af965e9e97808b4666b6901554ae2bc473c"},"bloco":null,"codigo_saida":1,"comando":["/usr/local/bin/bandit","--recursive","/entrada","--format","json","--output","/saida/bruto.json.part"],"condicao":"C1","duracao_monotonica_segundos":0.917741996,"entrada_commit":"b6a4f97afd466e83e1f60781494252dec1c37039","entrada_sha256":"d48bee2fa970226f9763b21c0a5bcc9711e72137578bb1ed7220db0c8c8783aa","estado":"falha","execucao_id":"C1-ALVO-0022-R01","falha_mensagem":"results[10].line_range deve começar em line_number","falha_tipo":"formato","ferramenta":"bandit","finalidade":"coleta","imagem":"tcc-sast:py3.12.13-bandit1.9.4-semgrep1.172.0","imagem_digest":"sha256:4680184d423a5304784739e696933e74a556ed3ec3d9ea63dcc4a3e69ea691ad","inicio_utc":"2026-08-11T15:16:14.831320Z","repeticao":1,"schema_version":"1.0","tentativa":1,"termino_utc":"2026-08-11T15:16:15.749075Z"}