{"alvo":"ALVO-0001","artefatos_sha256":{},"bloco":null,"codigo_saida":null,"comando":["/usr/local/bin/semgrep","scan","--config","/opt/regras-semgrep/python","--json","--metrics=off","--jobs","1","--output","/saida/bruto.json.part","/entrada"],"condicao":"C2","duracao_monotonica_segundos":null,"entrada_commit":"7d40f4b7939c901610ed9b85724552d60e7d63fa","entrada_sha256":"60913ac90d496cf087a5fe6e9a4dbb04882c862a93f7d094eebb692d41467206","estado":"em_execucao","execucao_id":"C2-ALVO-0001-R01","falha_mensagem":null,"falha_tipo":null,"ferramenta":"semgrep","finalidade":"fumaca","imagem":"tcc-sast:py3.12.13-bandit1.9.4-semgrep1.172.0","imagem_digest":"sha256:a08aacb91c2482fd2baa97cf06334b72839925893f6b80a3fe01d484ce794580","inicio_utc":"2026-08-11T12:34:46.237452Z","repeticao":1,"schema_version":"1.0","tentativa":1,"termino_utc":null}