{"alvo":"ALVO-0008","artefatos_sha256":{"bruto.json":"d2e0662bb8597dbee9eb2cbf9e1f19dbd3747c4c0ee45c6d930d54e66c1ea409","manifesto.em_execucao.json":"4223b2dd24929c510be8032d9067952dbb50dc2947f40b35c24fced7bdbe2de1","manifesto.pendente.json":"8a96d558533c2ad426f26c38d1d0a3484730f4e055075c617940d817044a28b0","normalizado.json":"05622bf40f6def4769ed679688bf27400de09bfd50f1687945f2c876758af473","processo.json":"fc1a64a9f5ba46878c85ed11243b8eb6d489525ebb69e6f8144e309e30f58a13","stderr.bin":"cac12c5204db399e5898a6696ce34500bab06ed4192d60fadbd0da7a44f0f42c","stdout.bin":"e3b0c44298fc1c149afbf4c8996fb92427ae41e4649b934ca495991b7852b855","versoes.json":"8806f416b2b2d13361d0c8e28f13f54569e336c39069a6f4751bb2482839fc2b"},"bloco":null,"codigo_saida":0,"comando":["/usr/local/bin/semgrep","scan","--config","/opt/regras-semgrep/python","--json","--metrics=off","--jobs","1","--output","/saida/bruto.json.part","/entrada"],"condicao":"C2","duracao_monotonica_segundos":31.935264967,"entrada_commit":"d5d8875559e21222bbbaadb7b9f0af592c6eb7fa","entrada_sha256":"c8889b657d313114870620cc663f7e0aab4d4e3020f446c1e5411139a5f38c10","estado":"concluida","execucao_id":"C2-ALVO-0008-R01","falha_mensagem":null,"falha_tipo":null,"ferramenta":"semgrep","finalidade":"coleta","imagem":"tcc-sast:py3.12.13-bandit1.9.4-semgrep1.172.0","imagem_digest":"sha256:4680184d423a5304784739e696933e74a556ed3ec3d9ea63dcc4a3e69ea691ad","inicio_utc":"2026-08-11T15:10:34.181255Z","repeticao":1,"schema_version":"1.0","tentativa":1,"termino_utc":"2026-08-11T15:11:06.115328Z"}