{"alvo":"ALVO-0014","artefatos_sha256":{"bruto.json":"c36fc49f9f137cd37d77b80244d3034ef073f7a3388e6cd00c8f99f77926170e","manifesto.em_execucao.json":"6321e980f83b9b954626152dd5624195b98372fe326540978128ce2fac051540","manifesto.pendente.json":"7f81253ca061c3d09e35860a7a6821f8cbcdc5964d74a178132b7a4a9cae8394","normalizado.json":"301daa8ad06d8aea8565514b5c1a4b32ea71db8fcfe196f24722b0e6636c9210","processo.json":"7a4b58206e78d1821a8c9b6be4ece08935bd597697442629da6304234d6f6220","stderr.bin":"8725bcb7725395078fffce3426191660c2ecee7d0709d7a9e867052f085f3435","stdout.bin":"3becae746696ab5c4207c0f607c00f6f0f376116e74b7c5f7358cbae14278886","versoes.json":"ea188be6bb7686fa69e9b244c76e2af965e9e97808b4666b6901554ae2bc473c"},"bloco":null,"codigo_saida":1,"comando":["/usr/local/bin/bandit","--recursive","/entrada","--format","json","--output","/saida/bruto.json.part"],"condicao":"C1","duracao_monotonica_segundos":4.103268171,"entrada_commit":"2fb0c600245f50670e8b9233c784afe61e8b340b","entrada_sha256":"27bf852cbcf680894bd56783c4c6419117205526e69aad5502c355322e22b605","estado":"concluida","execucao_id":"C1-ALVO-0014-R01","falha_mensagem":null,"falha_tipo":null,"ferramenta":"bandit","finalidade":"coleta","imagem":"tcc-sast:py3.12.13-bandit1.9.4-semgrep1.172.0","imagem_digest":"sha256:fde946f0659e291969b8999849b3573f4c32dda17f5003b358e62628c11d12c4","inicio_utc":"2026-08-11T15:49:11.505234Z","repeticao":1,"schema_version":"1.0","tentativa":3,"termino_utc":"2026-08-11T15:49:15.608516Z"}