{"alvo":"ALVO-0006","artefatos_sha256":{},"bloco":null,"codigo_saida":null,"comando":["/usr/local/bin/bandit","--recursive","/entrada","--format","json","--output","/saida/bruto.json.part"],"condicao":"C1","duracao_monotonica_segundos":null,"entrada_commit":"25bdef1e32055bfb6366856acc5db829e61e3647","entrada_sha256":"c3a3ca1c23c9970d5a51ac60e544c1798adb6963cf64ac0e16a747e309b24b7c","estado":"pendente","execucao_id":"C1-ALVO-0006-R01","falha_mensagem":null,"falha_tipo":null,"ferramenta":"bandit","finalidade":"coleta","imagem":"tcc-sast:py3.12.13-bandit1.9.4-semgrep1.172.0","imagem_digest":"sha256:fde946f0659e291969b8999849b3573f4c32dda17f5003b358e62628c11d12c4","inicio_utc":null,"repeticao":1,"schema_version":"1.0","tentativa":3,"termino_utc":null}