{"alvo":"ALVO-0014","artefatos_sha256":{"bruto.json":"47a7527c45c7304017eedb521bdd303d47b9fbf1f7a6976612e8a2aa67f36feb","manifesto.em_execucao.json":"13ba13134e0b80d9a30ce14519023aa6ef35f5f4e3c8aa1fcacf7396ea44a16f","manifesto.pendente.json":"66e53175e4fb3f7c61d52b22f6b85e4e5435304e204076f257de642e8b68706a","processo.json":"d9f550706e0ab25cd01fb6117f8c4654d8e0dc61fd8b0f02f556e7b591525c8b","stderr.bin":"8725bcb7725395078fffce3426191660c2ecee7d0709d7a9e867052f085f3435","stdout.bin":"3becae746696ab5c4207c0f607c00f6f0f376116e74b7c5f7358cbae14278886","versoes.json":"ea188be6bb7686fa69e9b244c76e2af965e9e97808b4666b6901554ae2bc473c"},"bloco":null,"codigo_saida":1,"comando":["/usr/local/bin/bandit","--recursive","/entrada","--format","json","--output","/saida/bruto.json.part"],"condicao":"C1","duracao_monotonica_segundos":3.921509462,"entrada_commit":"2fb0c600245f50670e8b9233c784afe61e8b340b","entrada_sha256":"27bf852cbcf680894bd56783c4c6419117205526e69aad5502c355322e22b605","estado":"falha","execucao_id":"C1-ALVO-0014-R01","falha_mensagem":"results[6].line_range deve começar em line_number","falha_tipo":"formato","ferramenta":"bandit","finalidade":"coleta","imagem":"tcc-sast:py3.12.13-bandit1.9.4-semgrep1.172.0","imagem_digest":"sha256:4680184d423a5304784739e696933e74a556ed3ec3d9ea63dcc4a3e69ea691ad","inicio_utc":"2026-08-11T15:21:06.642979Z","repeticao":1,"schema_version":"1.0","tentativa":1,"termino_utc":"2026-08-11T15:21:10.564494Z"}