{"alvo":"ALVO-0022","artefatos_sha256":{"bruto.json":"8115c76e0f6913479aa3c89c1743ddd2c5fd48af1ae23e7b1f93b093f3aaecc9","manifesto.em_execucao.json":"1e232a4e3e1db14b92b3ba8031eb7bd71f5c704af97197e8d8e95938274834dd","manifesto.pendente.json":"0c7bdb0936dea1c371237f7ab638b9ebf12395c32405a5d1d4b07f9ad015e26e","normalizado.json":"9383e640bcbc12f38ba36e0f39bce4f9652580d53a37e44ceb9d78d3efd95aaa","processo.json":"5e8ec50a9bd578c6213f01552790be04c4c327b563fe6078bd5f71c0769888fe","stderr.bin":"8725bcb7725395078fffce3426191660c2ecee7d0709d7a9e867052f085f3435","stdout.bin":"e3b0c44298fc1c149afbf4c8996fb92427ae41e4649b934ca495991b7852b855","versoes.json":"ea188be6bb7686fa69e9b244c76e2af965e9e97808b4666b6901554ae2bc473c"},"bloco":null,"codigo_saida":1,"comando":["/usr/local/bin/bandit","--recursive","/entrada","--format","json","--output","/saida/bruto.json.part"],"condicao":"C1","duracao_monotonica_segundos":1.058856537,"entrada_commit":"b6a4f97afd466e83e1f60781494252dec1c37039","entrada_sha256":"d48bee2fa970226f9763b21c0a5bcc9711e72137578bb1ed7220db0c8c8783aa","estado":"concluida","execucao_id":"C1-ALVO-0022-R01","falha_mensagem":null,"falha_tipo":null,"ferramenta":"bandit","finalidade":"coleta","imagem":"tcc-sast:py3.12.13-bandit1.9.4-semgrep1.172.0","imagem_digest":"sha256:fde946f0659e291969b8999849b3573f4c32dda17f5003b358e62628c11d12c4","inicio_utc":"2026-08-11T15:48:18.071942Z","repeticao":1,"schema_version":"1.0","tentativa":3,"termino_utc":"2026-08-11T15:48:19.130815Z"}