{"alvo":"ALVO-0004","artefatos_sha256":{"bruto.json":"6e846ba4a593b8d465e442d4a4b2758ac9266689c91b6ab30dacbfc3810de052","manifesto.em_execucao.json":"b69008704751f892279268bd5eac9ca5d554718fa3d7d68924ce06996b379b06","manifesto.pendente.json":"852204256851f97aae053e5962a23a6e2ab629939a22dc314c6dcafc1fd46775","processo.json":"cb5950d7771a9043eb932ea304877fa539a495ba13f07ca86e5dfdeee0b6ca78","stderr.bin":"8725bcb7725395078fffce3426191660c2ecee7d0709d7a9e867052f085f3435","stdout.bin":"e3b0c44298fc1c149afbf4c8996fb92427ae41e4649b934ca495991b7852b855","versoes.json":"ea188be6bb7686fa69e9b244c76e2af965e9e97808b4666b6901554ae2bc473c"},"bloco":null,"codigo_saida":1,"comando":["/usr/local/bin/bandit","--recursive","/entrada","--format","json","--output","/saida/bruto.json.part"],"condicao":"C1","duracao_monotonica_segundos":1.402508339,"entrada_commit":"a06abb306ed3699bb2f073e3f41d3d9c57012819","entrada_sha256":"0288f05e2a7e04c7988263268b7453adb4e49892f0a0561ecf9355c58a4eb433","estado":"falha","execucao_id":"C1-ALVO-0004-R01","falha_mensagem":"results[3].line_range deve começar em line_number","falha_tipo":"formato","ferramenta":"bandit","finalidade":"coleta","imagem":"tcc-sast:py3.12.13-bandit1.9.4-semgrep1.172.0","imagem_digest":"sha256:4680184d423a5304784739e696933e74a556ed3ec3d9ea63dcc4a3e69ea691ad","inicio_utc":"2026-08-11T15:07:59.192486Z","repeticao":1,"schema_version":"1.0","tentativa":1,"termino_utc":"2026-08-11T15:08:00.595003Z"}