{"alvo":"ALVO-0003","artefatos_sha256":{"bruto.json":"e5e40b841e404e0056f02e4c77fcd943b3c71ad52b9a01f7c25f874771d90266","manifesto.em_execucao.json":"d69e2ffdbf7763a811fab414f8af276bedf398de0dcfa53b2151971831e9084a","manifesto.pendente.json":"0b4d80b66d325cddf804e1d2e03c128b95fbaa4af9cd54c79582d807b0566be6","normalizado.json":"563897476812c77318298ed7ffe3d1965dee252281ef78e8de8ea5e9f04c2f69","processo.json":"abcbcfd16915646d7bba2f9aabb2ab7e1679f246c30da1b3e7d69eb8bcd28c6e","stderr.bin":"ff315849478ad251990a35cfedebc44cf1f7a250cdfe3b2ae6a82d22189ec313","stdout.bin":"e3b0c44298fc1c149afbf4c8996fb92427ae41e4649b934ca495991b7852b855","versoes.json":"8806f416b2b2d13361d0c8e28f13f54569e336c39069a6f4751bb2482839fc2b"},"bloco":null,"codigo_saida":0,"comando":["/usr/local/bin/semgrep","scan","--config","/opt/regras-semgrep/python","--json","--metrics=off","--jobs","1","--output","/saida/bruto.json.part","/entrada"],"condicao":"C2","duracao_monotonica_segundos":44.085113953,"entrada_commit":"082c88bfefced508ae083b92b459c808f95e905e","entrada_sha256":"cc553cf0774536dc6586307d5f82f1cc7ed9b02c0663e7806d5ddb2bcfd36c6d","estado":"concluida","execucao_id":"C2-ALVO-0003-R01","falha_mensagem":null,"falha_tipo":null,"ferramenta":"semgrep","finalidade":"coleta","imagem":"tcc-sast:py3.12.13-bandit1.9.4-semgrep1.172.0","imagem_digest":"sha256:4680184d423a5304784739e696933e74a556ed3ec3d9ea63dcc4a3e69ea691ad","inicio_utc":"2026-08-11T15:14:05.606362Z","repeticao":1,"schema_version":"1.0","tentativa":1,"termino_utc":"2026-08-11T15:14:49.689142Z"}