{"alvo":"ALVO-0001","artefatos_sha256":{"bruto.json":"ad7c01daa6064d0d662dd31d297c71be180376438afb64ae8602753507fefc50","manifesto.em_execucao.json":"3ae734a9a95db42c27b2dd048aa625a302f1da22b5bc53f0b654ff41fb817ecf","manifesto.pendente.json":"90cc815d82455cd0df40c756b3716d3aad8a419131dc4896af86df49fcfad6b5","normalizado.json":"5e52bacc87e5d71d6e5e5f7adf6f7eeb85e25e180bb2601a5aae83e2fdda870e","processo.json":"df77fbf71847b339c5c4ffa995504cd315dc9fccd99415f690010c3275ab98dd","stderr.bin":"8725bcb7725395078fffce3426191660c2ecee7d0709d7a9e867052f085f3435","stdout.bin":"e3b0c44298fc1c149afbf4c8996fb92427ae41e4649b934ca495991b7852b855","versoes.json":"ea188be6bb7686fa69e9b244c76e2af965e9e97808b4666b6901554ae2bc473c"},"bloco":null,"codigo_saida":1,"comando":["/usr/local/bin/bandit","--recursive","/entrada","--format","json","--output","/saida/bruto.json.part"],"condicao":"C1","duracao_monotonica_segundos":0.890142602,"entrada_commit":"7d40f4b7939c901610ed9b85724552d60e7d63fa","entrada_sha256":"60913ac90d496cf087a5fe6e9a4dbb04882c862a93f7d094eebb692d41467206","estado":"concluida","execucao_id":"C1-ALVO-0001-R01","falha_mensagem":null,"falha_tipo":null,"ferramenta":"bandit","finalidade":"fumaca","imagem":"tcc-sast:py3.12.13-bandit1.9.4-semgrep1.172.0","imagem_digest":"sha256:a08aacb91c2482fd2baa97cf06334b72839925893f6b80a3fe01d484ce794580","inicio_utc":"2026-08-11T12:34:42.879501Z","repeticao":1,"schema_version":"1.0","tentativa":1,"termino_utc":"2026-08-11T12:34:43.769782Z"}