{"alvo":"ALVO-SINTETICO","artefatos_sha256":{"bruto.json":"ae806a8ece2f28a38cf49dc16a9cfd83038333f435b26f6945addc1d33d9aa27","manifesto.em_execucao.json":"709e0dec0566539cc9cc69a722223871600d68bf22145e19000e340357285bdd","manifesto.pendente.json":"58c8400851b09b0d12103d94a21ab35a4136c146c1b2e6955e88efb8806f770e","normalizado.json":"9f8e05c425aabe60acc32dd06e0087d750c0634834ddd5101518bd8d1c57475f","processo.json":"1c6f0b1ab4f87bd51a75621c86dbc2212d2117a4e8909998b7c4622fde641d76","stderr.bin":"8725bcb7725395078fffce3426191660c2ecee7d0709d7a9e867052f085f3435","stdout.bin":"e3b0c44298fc1c149afbf4c8996fb92427ae41e4649b934ca495991b7852b855","versoes.json":"ea188be6bb7686fa69e9b244c76e2af965e9e97808b4666b6901554ae2bc473c"},"bloco":null,"codigo_saida":1,"comando":["/usr/local/bin/bandit","--recursive","/entrada","--format","json","--output","/saida/bruto.json.part"],"condicao":"C1","duracao_monotonica_segundos":0.684356307,"entrada_commit":null,"entrada_sha256":"1dbbff2e447b9ea0596f38b414c0d1e1ce4f5789e30f964b8dc568f39fd474ef","estado":"concluida","execucao_id":"C1-ALVO-SINTETICO-R01","falha_mensagem":null,"falha_tipo":null,"ferramenta":"bandit","finalidade":"fumaca","imagem":"tcc-sast:py3.12.13-bandit1.9.4-semgrep1.172.0","imagem_digest":"sha256:53c24a8b60a361c61d3dcce4a452dffdedb1a895164e2d23dd4f28b7bfd0f4e3","inicio_utc":"2026-08-11T03:02:58.942916Z","repeticao":1,"schema_version":"1.0","tentativa":1,"termino_utc":"2026-08-11T03:02:59.627343Z"}