{"alvo":"ALVO-0002","artefatos_sha256":{"bruto.json":"3e51dd1f18b18bc43aa09a9e0c8f7bcd179e79727d27760e308e8915a2ec3df8","manifesto.em_execucao.json":"256566fc0fe9734be2069474402e3b4705eeb3740860be2919c3191563159622","manifesto.pendente.json":"fac4321f38e2ca2152aa9a75baa0d6d02a820481f4c80c2ad026294f09cdd0ea","normalizado.json":"83707e55f56e00abad741137b788afd2a5a43d699df9d588cd0a84793683f419","processo.json":"ff31b04d43e7708554214ff2fa86b43faeabd7ed57fb50085e59d49c2bca5495","stderr.bin":"8725bcb7725395078fffce3426191660c2ecee7d0709d7a9e867052f085f3435","stdout.bin":"e3b0c44298fc1c149afbf4c8996fb92427ae41e4649b934ca495991b7852b855","versoes.json":"ea188be6bb7686fa69e9b244c76e2af965e9e97808b4666b6901554ae2bc473c"},"bloco":null,"codigo_saida":1,"comando":["/usr/local/bin/bandit","--recursive","/entrada","--format","json","--output","/saida/bruto.json.part"],"condicao":"C1","duracao_monotonica_segundos":1.987234888,"entrada_commit":"a961308c02d1fb462b192681c336b0739e432da7","entrada_sha256":"5cf3885877b3d63fe1f09e550d084daf6748cd2ebdf32c3f91fc3a2448ef5454","estado":"concluida","execucao_id":"C1-ALVO-0002-R01","falha_mensagem":null,"falha_tipo":null,"ferramenta":"bandit","finalidade":"coleta","imagem":"tcc-sast:py3.12.13-bandit1.9.4-semgrep1.172.0","imagem_digest":"sha256:fde946f0659e291969b8999849b3573f4c32dda17f5003b358e62628c11d12c4","inicio_utc":"2026-08-11T15:47:36.496239Z","repeticao":1,"schema_version":"1.0","tentativa":3,"termino_utc":"2026-08-11T15:47:38.482491Z"}